contestId,index,name,tags,rating,solvedCount,vector
1840,G2,In Search of Truth (Hard Version),constructive algorithms interactive math probabilities,,138,constructive algorithms interactive math probabilities nan
1840,G1,In Search of Truth (Easy Version),brute force constructive algorithms interactive math probabilities,,572,brute force constructive algorithms interactive math probabilities nan
1840,F,Railguns,dfs and similar dp graphs implementation,,302,dfs and similar dp graphs implementation nan
1840,E,Character Blocking,data structures implementation,,2680,data structures implementation nan
1840,D,Wooden Toy Festival,binary search greedy sortings,,5257,binary search greedy sortings nan
1840,C,Ski Resort,combinatorics math two pointers,,12340,combinatorics math two pointers nan
1840,B,Binary Cafe,bitmasks combinatorics math,,11526,bitmasks combinatorics math nan
1840,A,Cipher Shifer,implementation strings two pointers,,18844,implementation strings two pointers nan
1839,E,Decreasing Game,constructive algorithms dp greedy interactive,,537,constructive algorithms dp greedy interactive nan
1839,D,Ball Sorting,data structures dp sortings,,1046,data structures dp sortings nan
1839,C,Insert Zero and Invert Prefix,constructive algorithms,,6948,constructive algorithms nan
1839,B,Lamps,greedy sortings,,9656,greedy sortings nan
1839,A,The Good Array,greedy implementation math,,12723,greedy implementation math nan
1838,F,Stuck Conveyor,binary search constructive algorithms interactive,,96,binary search constructive algorithms interactive nan
1838,E,Count Supersequences,combinatorics dp math,,546,combinatorics dp math nan
1838,D,Bracket Walk,data structures greedy strings,,1553,data structures greedy strings nan
1838,C,No Prime Differences,constructive algorithms math number theory,,7884,constructive algorithms math number theory nan
1838,B,Minimize Permutation Subarrays,constructive algorithms math,,10912,constructive algorithms math nan
1838,A,Blackboard List,constructive algorithms math,,15073,constructive algorithms math nan
1837,F,Editorial for Two,binary search data structures greedy implementation,,1325,binary search data structures greedy implementation nan
1837,E,Playoff Fixing,combinatorics trees,,1457,combinatorics trees nan
1837,D,Bracket Coloring,constructive algorithms greedy,,9038,constructive algorithms greedy nan
1837,C,Best Binary String,constructive algorithms greedy,,15853,constructive algorithms greedy nan
1837,B,Comparison String,greedy,,18172,greedy nan
1837,A,Grasshopper on a Line,constructive algorithms math,,21365,constructive algorithms math nan
1833,G,Ksyusha and Chinchilla,constructive algorithms dfs and similar dp dsu greedy implementation trees,1800.0,2956,constructive algorithms dfs and similar dp dsu greedy implementation trees 1800.0
1833,F,Ira and Flamenco,combinatorics constructive algorithms data structures implementation math sortings two pointers,1700.0,4296,combinatorics constructive algorithms data structures implementation math sortings two pointers 1700.0
1833,E,Round Dance,dfs and similar dsu graphs shortest paths,1600.0,6420,dfs and similar dsu graphs shortest paths 1600.0
1833,D,Flipper,brute force constructive algorithms greedy,1400.0,9301,brute force constructive algorithms greedy 1400.0
1833,C,Vlad Building Beautiful Array,greedy math,800.0,20587,greedy math 800.0
1833,B,Restore the Weather,greedy sortings,900.0,19235,greedy sortings 900.0
1833,A,Musical Puzzle,implementation strings,800.0,25186,implementation strings 800.0
1832,F,Zombies,binary search dp,3200.0,168,binary search dp 3200.0
1832,E,Combinatorics Problem,brute force combinatorics dp,2200.0,1507,brute force combinatorics dp 2200.0
1832,D2,Red-Blue Operations (Hard Version),binary search constructive algorithms greedy implementation math,2400.0,1316,binary search constructive algorithms greedy implementation math 2400.0
1832,D1,Red-Blue Operations (Easy Version),binary search greedy implementation math,2100.0,2091,binary search greedy implementation math 2100.0
1832,C,Contrast Value,greedy implementation,1200.0,12295,greedy implementation 1200.0
1832,B,Maximum Sum,brute force sortings two pointers,1100.0,13892,brute force sortings two pointers 1100.0
1832,A,New Palindrome,strings,800.0,19749,strings 800.0
1831,B,Array merging,constructive algorithms greedy,1000.0,12923,constructive algorithms greedy 1000.0
1831,A,Twin Permutations,constructive algorithms,800.0,17750,constructive algorithms 800.0
1830,F,The Third Grace,data structures dp,3200.0,48,data structures dp 3200.0
1830,E,Bully Sort,data structures math,3500.0,85,data structures math 3500.0
1830,D,Mex Tree,brute force dp trees,2800.0,289,brute force dp trees 2800.0
1830,C,Hyperregular Bracket Strings,combinatorics greedy hashing math number theory sortings,2400.0,926,combinatorics greedy hashing math number theory sortings 2400.0
1830,B,The BOSS Can Count Pairs,brute force math,2000.0,2957,brute force math 2000.0
1830,A,Copil Copac Draws Trees,dfs and similar dp graphs trees,1400.0,8187,dfs and similar dp graphs trees 1400.0
1829,H,Don't Blame Me,bitmasks combinatorics dp math,1700.0,4116,bitmasks combinatorics dp math 1700.0
1829,G,Hits Different,data structures dp implementation math,1600.0,5697,data structures dp implementation math 1600.0
1829,F,Forever Winter,dfs and similar graphs math,1300.0,10405,dfs and similar graphs math 1300.0
1829,E,The Lakes,dfs and similar dsu graphs implementation,1100.0,12308,dfs and similar dsu graphs implementation 1100.0
1829,D,Gold Rush,brute force dfs and similar dp implementation,1000.0,16311,brute force dfs and similar dp implementation 1000.0
1829,C,Mr. Perfectly Fine,bitmasks greedy implementation,800.0,19812,bitmasks greedy implementation 800.0
1829,B,Blank Space,implementation,800.0,26366,implementation 800.0
1829,A,Love Story,implementation strings,800.0,28848,implementation strings 800.0
1828,B,Permutation Swap,math number theory,900.0,15086,math number theory 900.0
1828,A,Divisible Array,constructive algorithms math,800.0,18646,constructive algorithms math 800.0
1827,F,Copium Permutation,constructive algorithms data structures greedy,3500.0,65,constructive algorithms data structures greedy 3500.0
1827,E,Bus Routes,binary search constructive algorithms dfs and similar greedy trees,3400.0,176,binary search constructive algorithms dfs and similar greedy trees 3400.0
1827,D,Two Centroids,data structures dfs and similar greedy trees,2800.0,406,data structures dfs and similar greedy trees 2800.0
1827,C,Palindrome Partition,binary search brute force data structures dp hashing strings,2600.0,692,binary search brute force data structures dp hashing strings 2600.0
1827,B2,Range Sorting (Hard Version),binary search data structures dp greedy,2400.0,1175,binary search data structures dp greedy 2400.0
1827,B1,Range Sorting (Easy Version),binary search dp dsu greedy trees two pointers,2000.0,2644,binary search dp dsu greedy trees two pointers 2000.0
1827,A,Counting Orders,combinatorics math sortings two pointers,1100.0,13133,combinatorics math sortings two pointers 1100.0
1826,F,Fading into Fog,geometry interactive math probabilities,2800.0,238,geometry interactive math probabilities 2800.0
1826,E,Walk the Runway,bitmasks brute force data structures dp graphs implementation sortings,2400.0,1074,bitmasks brute force data structures dp graphs implementation sortings 2400.0
1826,D,Running Miles,brute force dp greedy,1700.0,4990,brute force dp greedy 1700.0
1826,C,Dreaming of Freedom,greedy math number theory,1300.0,8860,greedy math number theory 1300.0
1826,B,Lunatic Never Content,math number theory,1100.0,11223,math number theory 1100.0
1826,A,Trust Nobody,brute force greedy implementation sortings,1200.0,10530,brute force greedy implementation sortings 1200.0
1825,B,LuoTianyi and the Table,greedy math,1000.0,11370,greedy math 1000.0
1825,A,LuoTianyi and the Palindrome String,greedy strings,800.0,15655,greedy strings 800.0
1824,E,LuoTianyi and Cartridge,data structures trees,3500.0,84,data structures trees 3500.0
1824,D,LuoTianyi and the Function,data structures,3000.0,262,data structures 3000.0
1824,C,LuoTianyi and XOR-Tree,data structures dfs and similar dp dsu greedy trees,2500.0,822,data structures dfs and similar dp dsu greedy trees 2500.0
1824,B2,LuoTianyi and the Floating Islands (Hard Version),combinatorics dfs and similar math probabilities trees,2300.0,1878,combinatorics dfs and similar math probabilities trees 2300.0
1824,B1,LuoTianyi and the Floating Islands (Easy Version),combinatorics math probabilities trees,1800.0,3165,combinatorics math probabilities trees 1800.0
1824,A,LuoTianyi and the Show,greedy implementation,1400.0,8159,greedy implementation 1400.0
1823,F,Random Walk,dp graphs math probabilities trees,2600.0,470,dp graphs math probabilities trees 2600.0
1823,E,Removing Graph,brute force dp games graphs math,2500.0,919,brute force dp games graphs math 2500.0
1823,D,Unique Palindromes,constructive algorithms math strings,1900.0,2772,constructive algorithms math strings 1900.0
1823,C,Strongly Composite,greedy math number theory,1300.0,8730,greedy math number theory 1300.0
1823,B,Sort with Step,brute force math sortings,900.0,11981,brute force math sortings 900.0
1823,A,A-characteristic,combinatorics constructive algorithms math,800.0,13332,combinatorics constructive algorithms math 800.0
1822,G2,Magic Triples (Hard Version),brute force data structures math number theory,2200.0,1583,brute force data structures math number theory 2200.0
1822,G1,Magic Triples (Easy Version),brute force data structures math number theory,1700.0,4400,brute force data structures math number theory 1700.0
1822,F,Gardening Friends,brute force dfs and similar dp graphs trees,1700.0,3518,brute force dfs and similar dp graphs trees 1700.0
1822,E,Making Anti-Palindromes,greedy math strings,1600.0,6587,greedy math strings 1600.0
1822,D,Super-Permutation,constructive algorithms math,1200.0,11802,constructive algorithms math 1200.0
1822,C,Bun Lover,math,800.0,18066,math 800.0
1822,B,Karina and Array,greedy math sortings,800.0,19398,greedy math sortings 800.0
1822,A,TubeTube Feed,brute force implementation,800.0,19493,brute force implementation 800.0
1821,F,Timber,combinatorics dp fft math,2600.0,501,combinatorics dp fft math 2600.0
1821,E,Rearrange Brackets,brute force dp greedy sortings strings,2100.0,1593,brute force dp greedy sortings strings 2100.0
1821,D,Black Cells,binary search brute force greedy math,1900.0,3593,binary search brute force greedy math 1900.0
1821,C,Tear It Apart,brute force implementation math strings,1300.0,9984,brute force implementation math strings 1300.0
1821,B,Sort the Subarray,brute force greedy,1100.0,13006,brute force greedy 1100.0
1821,A,Matching,combinatorics math,800.0,16143,combinatorics math 800.0
1820,B,JoJo's Incredible Adventures,math strings two pointers,1100.0,10226,math strings two pointers 1100.0
1820,A,Yura's New Name,implementation strings,800.0,13715,implementation strings 800.0
1819,F,"Willy-nilly, Crack, Into Release!",data structures dp,3500.0,89,data structures dp 3500.0
1819,E,Roads in E City,interactive math probabilities trees,3200.0,165,interactive math probabilities trees 3200.0
1819,D,Misha and Apples,brute force data structures dp two pointers,2800.0,447,brute force data structures dp two pointers 2800.0
1819,C,The Fox and the Complete Tree Traversal,constructive algorithms dp implementation math trees,2400.0,1048,constructive algorithms dp implementation math trees 2400.0
1819,B,The Butcher,geometry greedy implementation sortings two pointers,1900.0,2612,geometry greedy implementation sortings two pointers 1900.0
1819,A,Constructive Problem,brute force greedy,1300.0,9201,brute force greedy 1300.0
1818,B,Indivisible,constructive algorithms,900.0,10617,constructive algorithms 900.0
1818,A,Politics,greedy implementation,800.0,10694,greedy implementation 800.0
1817,F,Entangled Substrings,string suffix structures strings,3500.0,92,string suffix structures strings 3500.0
1817,E,Half-sum,brute force divide and conquer greedy,3400.0,156,brute force divide and conquer greedy 3400.0
1817,D,Toy Machine,constructive algorithms games implementation,2700.0,442,constructive algorithms games implementation 2700.0
1817,C,Similar Polynomials,combinatorics math,2400.0,725,combinatorics math 2400.0
1817,B,Fish Graph,brute force constructive algorithms dfs and similar graphs,1900.0,2739,brute force constructive algorithms dfs and similar graphs 1900.0
1817,A,Almost Increasing Subsequence,binary search data structures greedy,1500.0,7437,binary search data structures greedy 1500.0
1816,B,Grid Reconstruction,constructive algorithms greedy,1000.0,12377,constructive algorithms greedy 1000.0
1816,A,Ian Visits Mary,constructive algorithms geometry number theory,800.0,14760,constructive algorithms geometry number theory 800.0
1815,F,OH NO1 (-2-3-4),constructive algorithms graphs math,3500.0,131,constructive algorithms graphs math 3500.0
1815,E,Bosco and Particle,dp math number theory strings,3100.0,178,dp math number theory strings 3100.0
1815,D,XOR Counting,bitmasks combinatorics dp math,2600.0,716,bitmasks combinatorics dp math 2600.0
1815,C,Between,constructive algorithms dfs and similar graphs greedy,2200.0,1414,constructive algorithms dfs and similar graphs greedy 2200.0
1815,B,Sum Graph,brute force constructive algorithms graphs implementation interactive shortest paths trees,2000.0,2256,brute force constructive algorithms graphs implementation interactive shortest paths trees 2000.0
1815,A,Ian and Array Sorting,greedy math,1300.0,10643,greedy math 1300.0
1814,F,Communication Towers,brute force divide and conquer dsu,2700.0,324,brute force divide and conquer dsu 2700.0
1814,E,Chain Chips,data structures dp matrices,2300.0,905,data structures dp matrices 2300.0
1814,D,Balancing Weapons,binary search brute force data structures math two pointers,2500.0,620,binary search brute force data structures math two pointers 2500.0
1814,C,Search in Parallel,constructive algorithms greedy sortings,1500.0,7734,constructive algorithms greedy sortings 1500.0
1814,B,Long Legs,brute force math,1700.0,7416,brute force math 1700.0
1814,A,Coins,implementation math,800.0,20293,implementation math 800.0
1811,G2,Vlad and the Nice Paths (hard version),binary search combinatorics data structures dp math two pointers,2200.0,1120,binary search combinatorics data structures dp math two pointers 2200.0
1811,G1,Vlad and the Nice Paths (easy version),combinatorics dp math,2100.0,1348,combinatorics dp math 2100.0
1811,F,Is It Flower?,dfs and similar graphs implementation,2100.0,1231,dfs and similar graphs implementation 2100.0
1811,E,Living Sequence,binary search dp math number theory,1500.0,8350,binary search dp math number theory 1500.0
1811,D,Umka and a Long Flight,constructive algorithms implementation math,1600.0,5286,constructive algorithms implementation math 1600.0
1811,C,Restore the Array,constructive algorithms greedy,1100.0,15438,constructive algorithms greedy 1100.0
1811,B,Conveyor Belts,implementation math,1000.0,16537,implementation math 1000.0
1811,A,Insert Digit,greedy math strings,800.0,24565,greedy math strings 800.0
1810,H,Last Number,combinatorics math,2900.0,83,combinatorics math 2900.0
1810,G,The Maximum Prefix,dp,3200.0,231,dp 3200.0
1810,F,M-tree,data structures math sortings trees,2800.0,408,data structures math sortings trees 2800.0
1810,E,Monsters,brute force data structures dfs and similar dsu graphs greedy,2100.0,2257,brute force data structures dfs and similar dsu graphs greedy 2100.0
1810,D,Climbing the Tree,binary search math,1700.0,5575,binary search math 1700.0
1810,C,Make It Permutation,brute force greedy sortings,1300.0,10975,brute force greedy sortings 1300.0
1810,B,Candies,constructive algorithms math number theory,800.0,15207,constructive algorithms math number theory 800.0
1810,A,Beautiful Sequence,brute force greedy,800.0,18039,brute force greedy 800.0
1809,G,Prediction,combinatorics dp math,2800.0,266,combinatorics dp math 2800.0
1809,F,Traveling in Berland,binary search data structures graphs greedy implementation,2500.0,552,binary search data structures graphs greedy implementation 2500.0
1809,E,Two Tanks,binary search dp implementation math,2400.0,610,binary search dp implementation math 2400.0
1809,D,Binary String Sorting,constructive algorithms greedy,1800.0,4525,constructive algorithms greedy 1800.0
1809,C,Sum on Subarrays,constructive algorithms greedy math,1500.0,9207,constructive algorithms greedy math 1500.0
1809,B,Points on Plane,binary search greedy math,1000.0,16117,binary search greedy math 1000.0
1809,A,Garland,implementation,800.0,21101,implementation 800.0
1808,E3,Minibuses on Venus (hard version),brute force combinatorics dp math,2800.0,273,brute force combinatorics dp math 2800.0
1808,E2,Minibuses on Venus (medium version),combinatorics divide and conquer dp matrices,2500.0,444,combinatorics divide and conquer dp matrices 2500.0
1808,E1,Minibuses on Venus (easy version),combinatorics divide and conquer dp,2200.0,896,combinatorics divide and conquer dp 2200.0
1808,D,"Petya, Petya, Petr, and Palindromes",binary search brute force data structures two pointers,2100.0,1682,binary search brute force data structures two pointers 2100.0
1808,C,Unlucky Numbers,brute force dp greedy implementation,1900.0,2748,brute force dp greedy implementation 1900.0
1808,B,Playing in a Casino,math sortings,1200.0,10413,math sortings 1200.0
1808,A,Lucky Numbers,brute force implementation,900.0,13876,brute force implementation 900.0
1807,G2,Subsequence Addition (Hard Version),bitmasks dp greedy implementation sortings,1100.0,13972,bitmasks dp greedy implementation sortings 1100.0
1807,G1,Subsequence Addition (Easy Version),brute force data structures dp greedy implementation sortings,1100.0,14474,brute force data structures dp greedy implementation sortings 1100.0
1807,F,Bouncy Ball,brute force dfs and similar implementation,1700.0,4376,brute force dfs and similar implementation 1700.0
1807,E,Interview,binary search implementation interactive,1300.0,8970,binary search implementation interactive 1300.0
1807,D,Odd Queries,data structures implementation,900.0,20887,data structures implementation 900.0
1807,C,Find and Replace,greedy implementation strings,800.0,24084,greedy implementation strings 800.0
1807,B,Grab the Candies,greedy,800.0,31417,greedy 800.0
1807,A,Plus or Minus,implementation,800.0,37255,implementation 800.0
1806,F2,GCD Master (hard version),greedy math sortings,2900.0,179,greedy math sortings 2900.0
1806,F1,GCD Master (easy version),greedy math number theory sortings,2900.0,222,greedy math number theory sortings 2900.0
1806,E,Tree Master,brute force data structures dfs and similar trees,2200.0,2024,brute force data structures dfs and similar trees 2200.0
1806,D,DSU Master,combinatorics dp dsu math,2500.0,639,combinatorics dp dsu math 2500.0
1806,C,Sequence Master,brute force constructive algorithms math,1600.0,5779,brute force constructive algorithms math 1600.0
1806,B,Mex Master,constructive algorithms greedy,900.0,14506,constructive algorithms greedy 900.0
1806,A,Walking Master,geometry greedy math,800.0,18500,geometry greedy math 800.0
1805,F2,Survival of the Weakest (hard version),greedy math sortings two pointers,3100.0,221,greedy math sortings two pointers 3100.0
1805,F1,Survival of the Weakest (easy version),binary search brute force implementation math sortings,2600.0,536,binary search brute force implementation math sortings 2600.0
1805,E,There Should Be a Lot of Maximums,brute force data structures dfs and similar dp trees two pointers,2300.0,1146,brute force data structures dfs and similar dp trees two pointers 2300.0
1805,D,"A Wide, Wide Graph",dfs and similar dp graphs greedy trees,1800.0,4440,dfs and similar dp graphs greedy trees 1800.0
1805,C,Place for a Selfie,binary search data structures geometry math,1400.0,9552,binary search data structures geometry math 1400.0
1805,B,The String Has a Target,greedy strings,800.0,16121,greedy strings 800.0
1805,A,We Need the Zero,bitmasks brute force,800.0,16522,bitmasks brute force 800.0
1804,H,Code Lock,bitmasks dp,3300.0,119,bitmasks dp 3300.0
1804,G,Flow Control,data structures dsu implementation,3500.0,143,data structures dsu implementation 3500.0
1804,F,Approximate Diameter,binary search divide and conquer graphs shortest paths,2700.0,632,binary search divide and conquer graphs shortest paths 2700.0
1804,E,Routing,bitmasks brute force dfs and similar dp graphs,2400.0,1134,bitmasks brute force dfs and similar dp graphs 2400.0
1804,D,Accommodation,brute force dp greedy implementation,2000.0,3718,brute force dp greedy implementation 2000.0
1804,C,Pull Your Luck,brute force greedy math number theory,1500.0,9358,brute force greedy math number theory 1500.0
1804,B,Vaccination,greedy implementation,1000.0,11911,greedy implementation 1000.0
1804,A,Lame King,greedy math,800.0,16256,greedy math 800.0
1802,B,Settlement of Guinea Pigs,greedy implementation math,1000.0,10951,greedy implementation math 1000.0
1802,A,Likes,greedy implementation,800.0,13852,greedy implementation 800.0
1801,G,A task for substrings,data structures string suffix structures strings,3400.0,132,data structures string suffix structures strings 3400.0
1801,F,Another n-dimensional chocolate bar,dp math meet-in-the-middle number theory,2700.0,400,dp math meet-in-the-middle number theory 2700.0
1801,E,Gasoline prices,data structures divide and conquer dsu hashing trees,3000.0,265,data structures divide and conquer dsu hashing trees 3000.0
1801,D,The way home,binary search data structures dp graphs greedy shortest paths sortings,2100.0,1411,binary search data structures dp graphs greedy shortest paths sortings 2100.0
1801,C,Music Festival,binary search data structures dp greedy sortings,1900.0,2344,binary search data structures dp greedy sortings 1900.0
1801,B,Buying gifts,data structures greedy sortings,1800.0,4454,data structures greedy sortings 1800.0
1801,A,The Very Beautiful Blanket,bitmasks constructive algorithms,1600.0,6560,bitmasks constructive algorithms 1600.0
1800,G,Symmetree,dfs and similar hashing implementation trees,2200.0,1446,dfs and similar hashing implementation trees 2200.0
1800,F,Dasha and Nightmares,bitmasks hashing meet-in-the-middle strings,1900.0,2746,bitmasks hashing meet-in-the-middle strings 1900.0
1800,E2,Unforgivable Curse (hard version),brute force constructive algorithms dfs and similar dsu graphs greedy strings,1500.0,9116,brute force constructive algorithms dfs and similar dsu graphs greedy strings 1500.0
1800,E1,Unforgivable Curse (easy version),brute force constructive algorithms dsu graphs greedy strings,1400.0,9362,brute force constructive algorithms dsu graphs greedy strings 1400.0
1800,D,Remove Two Letters,data structures greedy hashing strings,1200.0,16047,data structures greedy hashing strings 1200.0
1800,C2,Powering the Hero (hard version),data structures greedy,1100.0,16997,data structures greedy 1100.0
1800,C1,Powering the Hero (easy version),data structures greedy,1000.0,18022,data structures greedy 1000.0
1800,B,Count the Number of Pairs,greedy strings,1000.0,19547,greedy strings 1000.0
1800,A,Is It a Cat?,implementation strings,800.0,24295,implementation strings 800.0
1799,H,Tree Cutting,bitmasks dfs and similar dp,3200.0,174,bitmasks dfs and similar dp 3200.0
1799,G,Count Voting,combinatorics dp math,2600.0,501,combinatorics dp math 2600.0
1799,F,Halve or Subtract,binary search brute force dp greedy sortings,2700.0,591,binary search brute force dp greedy sortings 2700.0
1799,E,City Union,constructive algorithms dfs and similar dsu geometry greedy implementation math,2300.0,945,constructive algorithms dfs and similar dsu geometry greedy implementation math 2300.0
1799,D2,Hot Start Up (hard version),data structures dp,2100.0,1767,data structures dp 2100.0
1799,D1,Hot Start Up (easy version),dp,1900.0,3057,dp 1900.0
1799,C,Double Lexicographically Minimum,greedy strings,1700.0,4315,greedy strings 1700.0
1799,B,Equalize by Divide,brute force constructive algorithms greedy math,1200.0,8744,brute force constructive algorithms greedy math 1200.0
1799,A,Recent Actions,data structures greedy implementation math,800.0,10313,data structures greedy implementation math 800.0
1798,F,Gifts from Grandfather Ahmed,dp math number theory,2500.0,341,dp math number theory 2500.0
1798,E,Multitest Generator,brute force dp,2300.0,1199,brute force dp 2300.0
1798,D,Shocking Arrangement,constructive algorithms greedy math,1600.0,6898,constructive algorithms greedy math 1600.0
1798,C,Candy Store,greedy math number theory,1700.0,6408,greedy math number theory 1700.0
1798,B,Three Sevens,brute force data structures greedy implementation,1000.0,13453,brute force data structures greedy implementation 1000.0
1798,A,Showstopper,greedy implementation sortings,800.0,17441,greedy implementation sortings 800.0
1797,F,Li Hua and Path,data structures dfs and similar divide and conquer dsu trees,3000.0,191,data structures dfs and similar divide and conquer dsu trees 3000.0
1797,E,Li Hua and Array,brute force data structures dsu math number theory two pointers,2300.0,865,brute force data structures dsu math number theory two pointers 2300.0
1797,D,Li Hua and Tree,brute force data structures dfs and similar dp implementation trees,1900.0,2698,brute force data structures dfs and similar dp implementation trees 1900.0
1797,C,Li Hua and Chess,constructive algorithms greedy interactive,1600.0,5686,constructive algorithms greedy interactive 1600.0
1797,B,Li Hua and Pattern,constructive algorithms greedy,1100.0,11745,constructive algorithms greedy 1100.0
1797,A,Li Hua and Maze,constructive algorithms flows graphs greedy implementation,800.0,14536,constructive algorithms flows graphs greedy implementation 800.0
1796,F,Strange Triples,brute force math number theory,2900.0,114,brute force math number theory 2900.0
