contestId,index,name,tags,rating,solvedCount,vector
1525,C,Robot Collisions,data structures greedy implementation sortings,2000.0,3962,data structures greedy implementation sortings 2000.0
1525,B,Permutation Sort,constructive algorithms greedy,900.0,22561,constructive algorithms greedy 900.0
1525,A,Potion-making,math number theory,800.0,23925,math number theory 800.0
1523,H,Hopping Around the Array ,data structures dp,3500.0,173,data structures dp 3500.0
1523,G,Try Booking,data structures divide and conquer,3200.0,356,data structures divide and conquer 3200.0
1523,F,Favorite Game,bitmasks dp,3300.0,317,bitmasks dp 3300.0
1523,E,Crypto Lights,combinatorics dp math probabilities,2600.0,1331,combinatorics dp math probabilities 2600.0
1523,D,Love-Hate,bitmasks brute force dp probabilities,2400.0,1869,bitmasks brute force dp probabilities 2400.0
1523,C,Compression and Expansion,brute force data structures greedy implementation trees,1600.0,8150,brute force data structures greedy implementation trees 1600.0
1523,B,Lord of the Values,constructive algorithms,1100.0,11574,constructive algorithms 1100.0
1523,A,Game of Life,implementation,800.0,13159,implementation 800.0
1521,E,Nastia and a Beautiful Matrix,binary search constructive algorithms dp greedy,2700.0,589,binary search constructive algorithms dp greedy 2700.0
1521,D,Nastia Plays with a Tree,constructive algorithms data structures dfs and similar dp dsu greedy implementation trees,2500.0,1574,constructive algorithms data structures dfs and similar dp dsu greedy implementation trees 2500.0
1521,C,Nastia and a Hidden Permutation,constructive algorithms interactive,2000.0,4057,constructive algorithms interactive 2000.0
1521,B,Nastia and a Good Array,constructive algorithms math number theory,1300.0,18805,constructive algorithms math number theory 1300.0
1521,A,Nastia and Nearly Good Numbers,constructive algorithms math number theory,1000.0,30550,constructive algorithms math number theory 1000.0
1520,G,To Go Or Not To Go?,brute force dfs and similar graphs greedy implementation shortest paths,2200.0,3081,brute force dfs and similar graphs greedy implementation shortest paths 2200.0
1520,F2,Guess the K-th Zero (Hard version),binary search constructive algorithms data structures interactive,2200.0,2643,binary search constructive algorithms data structures interactive 2200.0
1520,F1,Guess the K-th Zero (Easy version),binary search interactive,1600.0,9487,binary search interactive 1600.0
1520,E,Arranging The Sheep,greedy math,1400.0,17429,greedy math 1400.0
1520,D,Same Differences,data structures hashing math,1200.0,33387,data structures hashing math 1200.0
1520,C,Not Adjacent Matrix,constructive algorithms,1000.0,27420,constructive algorithms 1000.0
1520,B,Ordinary Numbers,brute force math number theory,800.0,38029,brute force math number theory 800.0
1520,A,Do Not Be Distracted!,brute force implementation,800.0,43576,brute force implementation 800.0
1519,F,Chests and Keys,bitmasks brute force dfs and similar dp flows,3200.0,262,bitmasks brute force dfs and similar dp flows 3200.0
1519,E,Off by One,constructive algorithms dfs and similar geometry graphs sortings trees,2700.0,727,constructive algorithms dfs and similar geometry graphs sortings trees 2700.0
1519,D,Maximum Sum of Products,brute force dp implementation math two pointers,1600.0,13027,brute force dp implementation math two pointers 1600.0
1519,C,Berland Regional,brute force data structures greedy number theory sortings,1400.0,14518,brute force data structures greedy number theory sortings 1400.0
1519,B,The Cake Is a Lie,dp math,800.0,26983,dp math 800.0
1519,A,Red and Blue Beans,math,800.0,26214,math 800.0
1517,H,Fly Around the World,dp geometry,3500.0,55,dp geometry 3500.0
1517,G,Starry Night Camping,constructive algorithms flows graphs,3300.0,348,constructive algorithms flows graphs 3300.0
1517,F,Reunion,combinatorics dp trees,3200.0,322,combinatorics dp trees 3200.0
1517,E,Group Photo,binary search data structures implementation two pointers,2500.0,897,binary search data structures implementation two pointers 2500.0
1517,D,Explorer Space,dp graphs shortest paths,1800.0,6636,dp graphs shortest paths 1800.0
1517,C,Fillomino 2,constructive algorithms dfs and similar greedy implementation,1400.0,12214,constructive algorithms dfs and similar greedy implementation 1400.0
1517,B,Morning Jogging,constructive algorithms greedy sortings,1200.0,12618,constructive algorithms greedy sortings 1200.0
1517,A,Sum of 2050,greedy math,800.0,23826,greedy math 800.0
1516,E,Baby Ehab Plays with Permutations,combinatorics dp math,2500.0,735,combinatorics dp math 2500.0
1516,D,Cut,binary search data structures dp graphs number theory two pointers,2100.0,3523,binary search data structures dp graphs number theory two pointers 2100.0
1516,C,Baby Ehab Partitions Again,bitmasks constructive algorithms dp math,1700.0,10381,bitmasks constructive algorithms dp math 1700.0
1516,B,AGAGA XOOORRR,bitmasks brute force dp greedy,1500.0,16031,bitmasks brute force dp greedy 1500.0
1516,A,Tit for Tat,greedy,800.0,22350,greedy 800.0
1515,I,Phoenix and Diamonds,binary search data structures sortings,3400.0,182,binary search data structures sortings 3400.0
1515,H,Phoenix and Bits,bitmasks brute force data structures sortings,3500.0,186,bitmasks brute force data structures sortings 3500.0
1515,G,Phoenix and Odometers,dfs and similar graphs math number theory,2700.0,739,dfs and similar graphs math number theory 2700.0
1515,F,Phoenix and Earthquake,constructive algorithms dfs and similar dsu graphs greedy trees,2600.0,1402,constructive algorithms dfs and similar dsu graphs greedy trees 2600.0
1515,E,Phoenix and Computers,combinatorics dp math,2200.0,2983,combinatorics dp math 2200.0
1515,D,Phoenix and Socks,greedy sortings two pointers,1500.0,10463,greedy sortings two pointers 1500.0
1515,C,Phoenix and Towers,constructive algorithms data structures greedy,1400.0,14997,constructive algorithms data structures greedy 1400.0
1515,B,Phoenix and Puzzle,brute force geometry math number theory,1000.0,21903,brute force geometry math number theory 1000.0
1515,A,Phoenix and Gold,constructive algorithms greedy math,800.0,19470,constructive algorithms greedy math 800.0
1514,E,Baby Ehab's Hyper Apartment,binary search graphs interactive sortings two pointers,2700.0,444,binary search graphs interactive sortings two pointers 2700.0
1514,D,Cut and Stick,binary search data structures greedy implementation sortings,2000.0,3727,binary search data structures greedy implementation sortings 2000.0
1514,C,Product 1 Modulo N,greedy number theory,1600.0,12224,greedy number theory 1600.0
1514,B,"AND 0, Sum Big",bitmasks combinatorics math,1200.0,19182,bitmasks combinatorics math 1200.0
1514,A,Perfectly Imperfect Array,math number theory,800.0,22772,math number theory 800.0
1513,F,Swapping Problem,brute force constructive algorithms data structures sortings,2500.0,831,brute force constructive algorithms data structures sortings 2500.0
1513,E,Cost Equilibrium,combinatorics constructive algorithms math sortings,2300.0,1301,combinatorics constructive algorithms math sortings 2300.0
1513,D,GCD and MST,constructive algorithms dsu graphs greedy number theory sortings,2000.0,4359,constructive algorithms dsu graphs greedy number theory sortings 2000.0
1513,C,Add One,dp matrices,1600.0,11516,dp matrices 1600.0
1513,B,AND Sequences,bitmasks combinatorics constructive algorithms math,1400.0,12276,bitmasks combinatorics constructive algorithms math 1400.0
1513,A,Array and Peaks,constructive algorithms implementation,800.0,18691,constructive algorithms implementation 800.0
1512,G,Short Task,brute force dp math number theory,1700.0,6945,brute force dp math number theory 1700.0
1512,F,Education,brute force dp greedy implementation,1900.0,5342,brute force dp greedy implementation 1900.0
1512,E,Permutation by Sum,brute force greedy math,1600.0,9036,brute force greedy math 1600.0
1512,D,Corrupted Array,constructive algorithms data structures greedy,1200.0,19381,constructive algorithms data structures greedy 1200.0
1512,C,A-B Palindrome,constructive algorithms implementation strings,1200.0,17844,constructive algorithms implementation strings 1200.0
1512,B,Almost Rectangle,implementation,800.0,23971,implementation 800.0
1512,A,Spy Detected!,brute force implementation,800.0,48382,brute force implementation 800.0
1511,G,Chips on a Board,bitmasks brute force data structures dp games two pointers,2700.0,545,bitmasks brute force data structures dp games two pointers 2700.0
1511,F,Chainword,brute force data structures dp matrices string suffix structures strings,2700.0,333,brute force data structures dp matrices string suffix structures strings 2700.0
1511,E,Colorings and Dominoes,combinatorics dp greedy math,2100.0,2273,combinatorics dp greedy math 2100.0
1511,D,Min Cost String,brute force constructive algorithms graphs greedy strings,1600.0,10146,brute force constructive algorithms graphs greedy strings 1600.0
1511,C,Yet Another Card Deck,brute force data structures implementation trees,1100.0,19617,brute force data structures implementation trees 1100.0
1511,B,GCD Length,constructive algorithms math number theory,1100.0,20246,constructive algorithms math number theory 1100.0
1511,A,Review Site,greedy,800.0,25653,greedy 800.0
1510,K,King's Task,brute force graphs implementation,1200.0,4949,brute force graphs implementation 1200.0
1510,J,Japanese Game,constructive algorithms math,2700.0,387,constructive algorithms math 2700.0
1510,I,Is It Rated?,greedy interactive math probabilities,2700.0,400,greedy interactive math probabilities 2700.0
1510,H,Hard Optimization,dp,3200.0,78,dp 3200.0
1510,G,Guide,,2100.0,1186, 2100.0
1510,F,Fiber Shape,,2800.0,51, 2800.0
1510,E,Equilibrium Point /\textbackslash/\textbackslash,,2700.0,195, 2700.0
1510,D,Digits,dp math number theory,2100.0,1648,dp math number theory 2100.0
1510,C,Cactus Not Enough,dfs and similar graph matchings graphs,2900.0,170,dfs and similar graph matchings graphs 2900.0
1510,B,Button Lock,flows graph matchings graphs,2600.0,621,flows graph matchings graphs 2600.0
1510,A,ASCII Automata Art,,3100.0,135, 3100.0
1509,C,The Sports Festival,dp greedy,1800.0,10293,dp greedy 1800.0
1509,B,TMT Document,greedy,1100.0,19873,greedy 1100.0
1509,A,Average Height,constructive algorithms,800.0,24182,constructive algorithms 800.0
1508,F,Optimal Encoding,brute force data structures,3500.0,88,brute force data structures 3500.0
1508,E,Tree Calendar,brute force constructive algorithms data structures dfs and similar sortings trees,3100.0,296,brute force constructive algorithms data structures dfs and similar sortings trees 3100.0
1508,D,Swap Pass,constructive algorithms geometry sortings,3000.0,405,constructive algorithms geometry sortings 3000.0
1508,C,Complete the MST,bitmasks brute force data structures dfs and similar dsu graphs greedy trees,2500.0,1188,bitmasks brute force data structures dfs and similar dsu graphs greedy trees 2500.0
1508,B,Almost Sorted,binary search combinatorics constructive algorithms implementation,1800.0,3535,binary search combinatorics constructive algorithms implementation 1800.0
1508,A,Binary Literature,constructive algorithms greedy implementation strings two pointers,1900.0,5585,constructive algorithms greedy implementation strings two pointers 1900.0
1506,G,Maximize the Remaining String,brute force data structures dp greedy strings,2000.0,3698,brute force data structures dp greedy strings 2000.0
1506,F,Triangular Paths,constructive algorithms graphs math shortest paths sortings,2000.0,2882,constructive algorithms graphs math shortest paths sortings 2000.0
1506,E,Restoring the Permutation,constructive algorithms implementation,1500.0,11549,constructive algorithms implementation 1500.0
1506,D,Epic Transformation,constructive algorithms data structures greedy,1400.0,18183,constructive algorithms data structures greedy 1400.0
1506,C,Double-ended Strings,brute force implementation strings,1000.0,21389,brute force implementation strings 1000.0
1506,B,Partial Replacement,greedy implementation,1100.0,18900,greedy implementation 1100.0
1506,A,Strange Table,math,800.0,28322,math 800.0
1505,I,"Mysterious language again, seriously?",*special,2200.0,476,*special 2200.0
1505,H,L BREAK into program,*special,2500.0,438,*special 2500.0
1505,G,Encoded message,*special implementation,2600.0,262,*special implementation 2600.0
1505,F,Math,*special math,2200.0,1367,*special math 2200.0
1505,E,Cakewalk,*special greedy implementation shortest paths,1800.0,1636,*special greedy implementation shortest paths 1800.0
1505,D,Xenolith? Hippodrome?,*special number theory,1800.0,677,*special number theory 1800.0
1505,C,Fibonacci Words,*special implementation,1400.0,5935,*special implementation 1400.0
1505,B,DMCA,*special implementation number theory,1600.0,5622,*special implementation number theory 1600.0
1505,A,Is it rated - 2,*special implementation interactive,900.0,12881,*special implementation interactive 900.0
1504,B,Flip the Bits,constructive algorithms greedy implementation math,1200.0,15821,constructive algorithms greedy implementation math 1200.0
1504,A, Déjà Vu,constructive algorithms strings,800.0,20512,constructive algorithms strings 800.0
1503,F,Balance the Cards,constructive algorithms data structures divide and conquer geometry graphs implementation,3500.0,110,constructive algorithms data structures divide and conquer geometry graphs implementation 3500.0
1503,E,2-Coloring,combinatorics dp math,3100.0,446,combinatorics dp math 3100.0
1503,D,Flip the Cards,2-sat constructive algorithms data structures greedy sortings two pointers,2600.0,882,2-sat constructive algorithms data structures greedy sortings two pointers 2600.0
1503,C,Travelling Salesman Problem,binary search data structures dp greedy shortest paths sortings two pointers,2200.0,2889,binary search data structures dp greedy shortest paths sortings two pointers 2200.0
1503,B,3-Coloring,constructive algorithms games interactive,1700.0,6488,constructive algorithms games interactive 1700.0
1503,A,Balance the Bits,constructive algorithms greedy,1600.0,12102,constructive algorithms greedy 1600.0
1501,B,Napoleon Cake,dp implementation sortings,900.0,17109,dp implementation sortings 900.0
1501,A,Alexey and Train,implementation,800.0,11374,implementation 800.0
1500,F,Cupboards Jumps,dp,3500.0,185,dp 3500.0
1500,E,Subset Trick,binary search data structures,3300.0,164,binary search data structures 3300.0
1500,D,Tiles for Bathroom,data structures sortings two pointers,2900.0,328,data structures sortings two pointers 2900.0
1500,C,Matrix Sorting,bitmasks brute force constructive algorithms greedy two pointers,2600.0,655,bitmasks brute force constructive algorithms greedy two pointers 2600.0
1500,B,Two chandeliers,binary search brute force chinese remainder theorem math number theory,2200.0,1872,binary search brute force chinese remainder theorem math number theory 2200.0
1500,A,Going Home,brute force hashing implementation math,1800.0,7985,brute force hashing implementation math 1800.0
1499,G,Graph Coloring,data structures graphs interactive,3100.0,162,data structures graphs interactive 3100.0
1499,F,Diameter Cuts,combinatorics dfs and similar dp trees,2400.0,1027,combinatorics dfs and similar dp trees 2400.0
1499,E,Chaotic Merge,combinatorics dp math strings,2400.0,1254,combinatorics dp math strings 2400.0
1499,D,The Number of Pairs,dp math number theory,2100.0,4806,dp math number theory 2100.0
1499,C,Minimum Grid Path,brute force data structures greedy math,1500.0,11551,brute force data structures greedy math 1500.0
1499,B,Binary Removals,brute force dp greedy implementation,1000.0,19040,brute force dp greedy implementation 1000.0
1499,A,Domino on Windowsill,combinatorics constructive algorithms math,800.0,20507,combinatorics constructive algorithms math 800.0
1498,F,Christmas Game,bitmasks data structures dfs and similar dp games math trees,2500.0,664,bitmasks data structures dfs and similar dp games math trees 2500.0
1498,E,Two Houses,brute force graphs greedy interactive sortings,2200.0,1675,brute force graphs greedy interactive sortings 2200.0
1498,D,Bananas in a Microwave,dfs and similar dp graphs implementation,2200.0,2132,dfs and similar dp graphs implementation 2200.0
1498,C,Planar Reflections,brute force data structures dp,1600.0,8419,brute force data structures dp 1600.0
1498,B,Box Fitting,binary search bitmasks data structures greedy,1300.0,14615,binary search bitmasks data structures greedy 1300.0
1498,A,GCD Sum,brute force math,800.0,21171,brute force math 800.0
1497,E2,Square-free division (hard version),data structures dp greedy math number theory two pointers,2500.0,1361,data structures dp greedy math number theory two pointers 2500.0
1497,E1,Square-Free Division (easy version),data structures dp greedy math number theory two pointers,1700.0,7348,data structures dp greedy math number theory two pointers 1700.0
1497,D,Genius,bitmasks dp graphs number theory,2500.0,1341,bitmasks dp graphs number theory 2500.0
1497,C2,k-LCM (hard version),constructive algorithms math,1600.0,14700,constructive algorithms math 1600.0
1497,C1,k-LCM (easy version),constructive algorithms math,1200.0,21377,constructive algorithms math 1200.0
1497,B,M-arrays,constructive algorithms greedy math,1200.0,16912,constructive algorithms greedy math 1200.0
1497,A,Meximization,brute force data structures greedy sortings,800.0,22775,brute force data structures greedy sortings 800.0
1496,B,Max and Mex,math,1100.0,16471,math 1100.0
1496,A,Split it!,brute force constructive algorithms greedy strings,900.0,19244,brute force constructive algorithms greedy strings 900.0
1495,F,Squares,constructive algorithms data structures dp graphs trees,3300.0,202,constructive algorithms data structures dp graphs trees 3300.0
1495,E,Qingshan and Daniel,brute force data structures greedy implementation,3200.0,312,brute force data structures greedy implementation 3200.0
1495,D,BFS Trees,combinatorics dfs and similar graphs math shortest paths trees,2600.0,1013,combinatorics dfs and similar graphs math shortest paths trees 2600.0
1495,C,Garden of the Sun,constructive algorithms graphs,2300.0,2323,constructive algorithms graphs 2300.0
1495,B,Let's Go Hiking,games greedy,1900.0,5514,games greedy 1900.0
1495,A,Diamond Miner,geometry greedy math sortings,1200.0,15749,geometry greedy math sortings 1200.0
1494,F,Delete The Edges,brute force constructive algorithms dfs and similar graphs implementation,2900.0,301,brute force constructive algorithms dfs and similar graphs implementation 2900.0
1494,E,A-Z Graph,constructive algorithms data structures graphs hashing,2400.0,1509,constructive algorithms data structures graphs hashing 2400.0
1494,D,Dogeforces,constructive algorithms data structures dfs and similar divide and conquer dsu greedy sortings trees,2300.0,2308,constructive algorithms data structures dfs and similar divide and conquer dsu greedy sortings trees 2300.0
1494,C,1D Sokoban,binary search dp greedy implementation two pointers,1900.0,4926,binary search dp greedy implementation two pointers 1900.0
1494,B,Berland Crossword,bitmasks brute force greedy implementation,1400.0,13114,bitmasks brute force greedy implementation 1400.0
1494,A,ABC String,bitmasks brute force implementation,900.0,19305,bitmasks brute force implementation 900.0
1493,F,Enchanted Matrix,bitmasks interactive number theory,2600.0,335,bitmasks interactive number theory 2600.0
1493,E,Enormous XOR,bitmasks constructive algorithms greedy math strings two pointers,2600.0,770,bitmasks constructive algorithms greedy math strings two pointers 2600.0
1493,D,GCD of an Array,brute force data structures hashing implementation math number theory sortings two pointers,2100.0,4238,brute force data structures hashing implementation math number theory sortings two pointers 2100.0
1493,C,K-beautiful Strings,binary search brute force constructive algorithms greedy strings,2000.0,4179,binary search brute force constructive algorithms greedy strings 2000.0
1493,B,Planet Lapituletti,brute force implementation,1300.0,11173,brute force implementation 1300.0
1493,A,Anti-knapsack,constructive algorithms greedy,800.0,18600,constructive algorithms greedy 800.0
1492,E,Almost Fault-Tolerant Database,brute force constructive algorithms dfs and similar greedy implementation,2500.0,1115,brute force constructive algorithms dfs and similar greedy implementation 2500.0
1492,D,Genius's Gambit,bitmasks constructive algorithms greedy math,1900.0,5598,bitmasks constructive algorithms greedy math 1900.0
1492,C,Maximum width,binary search data structures dp greedy two pointers,1500.0,14265,binary search data structures dp greedy two pointers 1500.0
1492,B,Card Deck,data structures greedy math,1100.0,17191,data structures greedy math 1100.0
1492,A,Three swimmers,math,800.0,21769,math 800.0
1491,I,Ruler Of The Zoo,brute force data structures,3500.0,61,brute force data structures 3500.0
1491,H,Yuezheng Ling and Dynamic Tree,data structures trees,3400.0,538,data structures trees 3400.0
1491,G,Switch and Flip,constructive algorithms graphs math,2800.0,614,constructive algorithms graphs math 2800.0
1491,F,Magnets,binary search constructive algorithms interactive,2700.0,820,binary search constructive algorithms interactive 2700.0
1491,E,Fib-tree,brute force dfs and similar divide and conquer number theory trees,2400.0,1836,brute force dfs and similar divide and conquer number theory trees 2400.0
1491,D,Zookeeper and The Infinite Zoo,bitmasks constructive algorithms dp greedy math,1800.0,6319,bitmasks constructive algorithms dp greedy math 1800.0
1491,C,Pekora and Trampoline,brute force data structures dp greedy implementation,1700.0,7242,brute force data structures dp greedy implementation 1700.0
1491,B,Minimal Cost,brute force math,1200.0,13045,brute force math 1200.0
1491,A,K-th Largest Value,brute force greedy implementation,800.0,17476,brute force greedy implementation 800.0
1490,G,Old Floppy Drive ,binary search data structures math,1900.0,4977,binary search data structures math 1900.0
1490,F,Equalize the Array,binary search data structures greedy math sortings,1500.0,13681,binary search data structures greedy math sortings 1500.0
1490,E,Accidental Victory,binary search data structures greedy,1400.0,16003,binary search data structures greedy 1400.0
1490,D,Permutation Transformation,dfs and similar divide and conquer implementation,1200.0,17297,dfs and similar divide and conquer implementation 1200.0
1490,C,Sum of Cubes,binary search brute force brute force math,1100.0,27073,binary search brute force brute force math 1100.0
1490,B,Balanced Remainders,brute force constructive algorithms math,1000.0,23777,brute force constructive algorithms math 1000.0
1490,A,Dense Array,greedy math,800.0,28642,greedy math 800.0
1488,J,Flower Shop,*special data structures fft math,3100.0,23,*special data structures fft math 3100.0
1488,I,Demonic Invasion,*special flows,3100.0,25,*special flows 3100.0
1488,H,Build From Suffixes,*special combinatorics data structures,2800.0,42,*special combinatorics data structures 2800.0
1488,G,Painting Numbers,*special data structures greedy number theory,2500.0,100,*special data structures greedy number theory 2500.0
1488,F,Dogecoin,*special *special binary search data structures,2300.0,140,*special *special binary search data structures 2300.0
1488,E,Palindromic Doubles,*special data structures dp,2200.0,177,*special data structures dp 2200.0
1488,D,Problemsolving Marathon,*special binary search greedy,1900.0,295,*special binary search greedy 1900.0
1488,C,Two Policemen,*special binary search brute force math,1900.0,372,*special binary search brute force math 1900.0
1488,B,RBS Deletion,*special greedy,1800.0,495,*special greedy 1800.0
1488,A,From Zero To Y,*special math,900.0,1143,*special math 900.0
1487,G,String Counting,combinatorics dp fft math,2700.0,519,combinatorics dp fft math 2700.0
1487,F,Ones,dp greedy shortest paths,2900.0,328,dp greedy shortest paths 2900.0
1487,E,Cheap Dinner,brute force data structures graphs greedy implementation sortings two pointers,2000.0,3972,brute force data structures graphs greedy implementation sortings two pointers 2000.0
1487,D,Pythagorean Triples,binary search brute force math number theory,1500.0,15055,binary search brute force math number theory 1500.0
1487,C,Minimum Ties,brute force constructive algorithms dfs and similar graphs greedy implementation math,1500.0,12463,brute force constructive algorithms dfs and similar graphs greedy implementation math 1500.0
1487,B,Cat Cycle,math number theory,1200.0,17317,math number theory 1200.0
1487,A,Arena,implementation sortings,800.0,24577,implementation sortings 800.0
1486,F,Pairs of Paths,combinatorics data structures dfs and similar dp trees,2600.0,526,combinatorics data structures dfs and similar dp trees 2600.0
1486,E,Paired Payment,binary search brute force constructive algorithms dp flows graphs shortest paths,2200.0,2572,binary search brute force constructive algorithms dp flows graphs shortest paths 2200.0
1486,D,Max Median,binary search data structures dp,2100.0,5549,binary search data structures dp 2100.0
1486,C2,Guessing the Greatest (hard version),binary search interactive,1900.0,7284,binary search interactive 1900.0
1486,C1,Guessing the Greatest (easy version),binary search interactive,1600.0,10427,binary search interactive 1600.0
1486,B,Eastern Exhibition,binary search geometry shortest paths sortings,1500.0,14092,binary search geometry shortest paths sortings 1500.0
1486,A,Shifting Stacks,greedy implementation,900.0,23161,greedy implementation 900.0
1485,F,Copy or Prefix Sum,combinatorics data structures dp sortings,2400.0,1619,combinatorics data structures dp sortings 2400.0
1485,E,Move and Swap,dfs and similar dp greedy trees,2500.0,1110,dfs and similar dp greedy trees 2500.0
